<?xml version="1.0" encoding="UTF-8"?>

<authorisationConfig xmlns:xsi="http://www.w3.org/2001/XMLSchema-instance"
        xsi:noNamespaceSchemaLocation="vertigo-security_1_0.xsd">
       
  	<!--  Permissions -->	
	<permission id="PRM_READ_ALL_PRODUCTS" operation="READ" filter="/products/.*" description="Lire tous les produits"/>		
	<permission id="PRM_WRITE_ALL_PRODUCTS" operation="WRITE" filter="/products/.*"  description="CrÃ©er/Modifier un produit"/>				
	
	<permission id="PRM_READ_ALL_FAMILLES" operation="READ" filter="/famille/.*" description="Lire toutes les familles"/>		
	<permission id="PRM_READ_MY_FAMILLE" operation="READ" filter="/famille/${famId}" description="Lire ma famille"/>		
	
	<!-- Roles -->
	<role name="R_READER" description="Lecteur de l'application">	  	   
  		<permission ref="PRM_READ_ALL_PRODUCTS"/>	
  	</role>

  	<role name="R_WRITER" description="Ecrivain de l'application">	  	   
  		<permission ref="PRM_READ_ALL_PRODUCTS" />
  		<permission ref="PRM_WRITE_ALL_PRODUCTS" />
  	</role>
  	
  	<role name="R_ALL_FAMILLES" description="Administeur de l'application">
  		<permission ref="PRM_READ_ALL_FAMILLES" />		
  	</role>

  	<role name="R_MY_FAMILLE" description="Lecteur de l'application">	  	   
  		<!--permission type="read" filter="/product/*"  -->
  		<permission ref="PRM_READ_MY_FAMILLE"/>
  	</role>
</authorisationConfig>
